mRID,aliasName,description,name,baseFrequency
52eeb9b8-015a-4535-ba56-1a6906f10289,FrekvensKontrolAarhus,"Regulerer den basale netfrekvens for stroemforsyning i Aarhus.","Aarhus BasisFrekvens",50
fc1be7cb-6ee4-4f75-8ec8-c9224754b96b,GrundlaeggendeFrekvensOestjylland,"Ansvarlig for opretholdelse af 50 Hz i elnettet over Oestjylland.","Oestjylland FrekvensRegulering",60
e4b048ff-ad58-4c78-a788-df80c44296be,NetFrekvensStyringAalborg,"Sikrer stabilitet og frekvensbalancer i Aalborgs elektriske system.","Aalborg FrekvensNet",50
4336fae1-c8a7-421c-a96e-92789947870d,BasisFrekvensVedligeholdOdense,"Vigtig komponent i frekvensstyring og drift i Odense.","Odense FrekvensVedligehold",60
f0943b45-4623-421f-9511-40bd322280f9,ReguleringAfFrekvensKoebenhavn,"Overvaager og justerer netfrekvensen i Koebenhavns metropolomraade.","Koebenhavn FrekvensKontrol",60
